{
  "schema_version": 1,
  "id": "qwenpaw-qwen3.8-max-ee27a7b616c3f45f1db7",
  "date": "2026-10-16T19:08:48Z",
  "kind": "official",
  "experiment": "qwenpaw-2.2.2-qwen3.8-max-20261016",
  "candidate_hash": "e37d843bb854132ad78dcff78843b3ebada55a0c24e07c19f4b66c14f8b2f0b9",
  "profile_hash": "397ad1941e1204e7323bbf67639ed333601559b47fda280d7ffba228b06aac2f",
  "sdk_version": "2.2.2",
  "source_sha": "5c56644a6e130762a236f8c946103e95a0a1eec8",
  "source_repository": "https://github.com/agentscope-ai/QwenPaw",
  "artifact_sha256": "fcc442bd4ca1b426104f16d3aff4e6c1da90a057a58f2b509d9497d2938afd4d",
  "provider": "dashscope",
  "model": "qwen3.8-max",
  "harness": "qwenpaw",
  "parameters": {
    "max_context_length": 1000000,
    "max_response_length": 131072
  },
  "exchange_rate": {
    "cny_per_usd": 7.0,
    "basis": "fixed"
  },
  "board": {
    "id": "acp-agents",
    "name": "ACP Agents",
    "group_by": "model_harness"
  },
  "benchmarks": [
    {
      "id": "gaia",
      "name": "GAIA",
      "revision": "1.0:004eaeda9ac5017a1d51e09bc19914d994f878b6",
      "expected": 165,
      "judge": {
        "kind": "programmatic",
        "model": null,
        "scorer": "harbor-gaia@1.0",
        "official_model": null,
        "prompt_revision": null,
        "parity_note": ""
      },
      "observation_id": "qwenpaw-2.2.2-qwen3.8-max-gaia-20261016",
      "protocol_hash": "d6b086f9768b96a4b7b08d1884b7305a19494ab3312ba8c1a1c445d457f92762",
      "date": "2026-10-16T18:31:55Z",
      "summary": {
        "score_sum": 135.0,
        "failures": {
          "timeout": 3
        },
        "model_cost": {
          "amount": 339.714528,
          "currency": "CNY"
        },
        "model_cost_count": 165,
        "judge_cost": {
          "amount": 0.0,
          "currency": "USD"
        },
        "judge_cost_count": 165,
        "runtime_seconds_sum": 100841.302778,
        "runtime_count": 165
      }
    },
    {
      "id": "pawbench",
      "name": "PawBench",
      "revision": "agentscope-ai/pawbench@4:sha256:b4e0ac2e4d5614fd46735f3ece1fb98207e02ea5818b07f9d5545f97fdde2bfe",
      "expected": 150,
      "judge": {
        "kind": "llm",
        "model": "qwen3.8-max",
        "scorer": null,
        "official_model": "claude-opus-4.6",
        "prompt_revision": "agentscope-ai/pawbench@4:bundled-per-task-rubric",
        "parity_note": ""
      },
      "observation_id": "qwenpaw-2.2.2-qwen3.8-max-pawbench-20261016",
      "protocol_hash": "51307dd5ad41b4f71bcfb8a9dc5e7688d45db2bc52e10c22c65a7afcb299fe49",
      "date": "2026-10-16T19:03:15Z",
      "summary": {
        "score_sum": 112.91919,
        "failures": {
          "scoring_error": 2,
          "execution_error": 2,
          "timeout": 2
        },
        "model_cost": {
          "amount": 316.895148,
          "currency": "CNY"
        },
        "model_cost_count": 150,
        "judge_cost": {
          "amount": 65.01944400000001,
          "currency": "CNY"
        },
        "judge_cost_count": 149,
        "runtime_seconds_sum": 124388.39644,
        "runtime_count": 150
      }
    },
    {
      "id": "spreadsheetbench-verified",
      "name": "SpreadsheetBench Verified",
      "revision": "1.0:0ad7209b09780e78c6c80f194e49e353191be1cc",
      "expected": 400,
      "judge": {
        "kind": "programmatic",
        "model": null,
        "scorer": "harbor-spreadsheetbench-verified@1.0",
        "official_model": null,
        "prompt_revision": null,
        "parity_note": ""
      },
      "observation_id": "qwenpaw-2.2.2-qwen3.8-max-spreadsheetbench-verified-20261016",
      "protocol_hash": "5cc9307f069776652f57c6f64ac6e48ccbe17528a1f34ba36a4565529d791479",
      "date": "2026-10-16T18:02:41Z",
      "summary": {
        "score_sum": 353.0,
        "failures": {
          "execution_error": 5
        },
        "model_cost": {
          "amount": 627.653916,
          "currency": "CNY"
        },
        "model_cost_count": 400,
        "judge_cost": {
          "amount": 0.0,
          "currency": "USD"
        },
        "judge_cost_count": 400,
        "runtime_seconds_sum": 224485.232049,
        "runtime_count": 400
      }
    },
    {
      "id": "swebench-verified",
      "name": "SWE-bench Verified",
      "revision": "1.0:86723674f04e4209ac479d0fb75d9d9f44b4377e",
      "expected": 500,
      "judge": {
        "kind": "programmatic",
        "model": null,
        "scorer": "harbor-swebench-verified@1.0",
        "official_model": null,
        "prompt_revision": null,
        "parity_note": ""
      },
      "observation_id": "qwenpaw-2.2.2-qwen3.8-max-swebench-verified-20261016",
      "protocol_hash": "b0d2ca829d6451a96cb592fe195d87efd27cb384ff18aeb51a916ab9356637a7",
      "date": "2026-10-16T19:08:48Z",
      "summary": {
        "score_sum": 469.0,
        "failures": {
          "execution_error": 10,
          "timeout": 9
        },
        "model_cost": {
          "amount": 1532.023056,
          "currency": "CNY"
        },
        "model_cost_count": 500,
        "judge_cost": {
          "amount": 0.0,
          "currency": "USD"
        },
        "judge_cost_count": 500,
        "runtime_seconds_sum": 478727.840362,
        "runtime_count": 500
      }
    }
  ]
}
