{
  "schema_version": 1,
  "id": "qwenpaw-glm-5.2-8bc7f654b9bf0cd108ac",
  "date": "2026-10-17T14:23:34Z",
  "kind": "official",
  "experiment": "qwenpaw-2.2.2-glm-5.2-20261016",
  "candidate_hash": "46ed18cc42725bea8018bddc3dde0351624c23451ab0e89e60c7ebb872dcc4d2",
  "profile_hash": "9e267df58361eee278fbc3755203a9057edde062a73898c044c157f9466c0e89",
  "sdk_version": "2.2.2",
  "source_sha": "5c56644a6e130762a236f8c946103e95a0a1eec8",
  "source_repository": "https://github.com/agentscope-ai/QwenPaw",
  "artifact_sha256": "fcc442bd4ca1b426104f16d3aff4e6c1da90a057a58f2b509d9497d2938afd4d",
  "provider": "dashscope",
  "model": "glm-5.2",
  "harness": "qwenpaw",
  "parameters": {
    "max_context_length": 1048576,
    "max_response_length": 131072
  },
  "exchange_rate": {
    "cny_per_usd": 7.0,
    "basis": "fixed"
  },
  "board": {
    "id": "acp-agents",
    "name": "ACP Agents",
    "group_by": "model_harness"
  },
  "benchmarks": [
    {
      "id": "gaia",
      "name": "GAIA",
      "revision": "1.0:004eaeda9ac5017a1d51e09bc19914d994f878b6",
      "expected": 165,
      "judge": {
        "kind": "programmatic",
        "model": null,
        "scorer": "harbor-gaia@1.0",
        "official_model": null,
        "prompt_revision": null,
        "parity_note": ""
      },
      "observation_id": "qwenpaw-2.2.2-glm-5.2-gaia-20261016",
      "protocol_hash": "098ff9180cc8b94d72cddd91792cb20d5eed56811156b9e24caaef967c6249b2",
      "date": "2026-10-16T19:40:02Z",
      "summary": {
        "score_sum": 112.0,
        "failures": {
          "execution_error": 5
        },
        "model_cost": {
          "amount": 452.692648,
          "currency": "CNY"
        },
        "model_cost_count": 165,
        "judge_cost": {
          "amount": 0.0,
          "currency": "USD"
        },
        "judge_cost_count": 165,
        "runtime_seconds_sum": 84120.269616,
        "runtime_count": 165
      }
    },
    {
      "id": "pawbench",
      "name": "PawBench",
      "revision": "agentscope-ai/pawbench@4:sha256:b4e0ac2e4d5614fd46735f3ece1fb98207e02ea5818b07f9d5545f97fdde2bfe",
      "expected": 150,
      "judge": {
        "kind": "llm",
        "model": "qwen3.8-max",
        "scorer": null,
        "official_model": "claude-opus-4.6",
        "prompt_revision": "agentscope-ai/pawbench@4:bundled-per-task-rubric",
        "parity_note": ""
      },
      "observation_id": "qwenpaw-2.2.2-glm-5.2-pawbench-20261016",
      "protocol_hash": "0ee17d8748117746bb847565bc63ee69fdb8d49a3deaf2366f1f26b6f36631ef",
      "date": "2026-10-16T18:37:23Z",
      "summary": {
        "score_sum": 105.46718,
        "failures": {
          "scoring_error": 2,
          "execution_error": 1
        },
        "model_cost": {
          "amount": 287.338716,
          "currency": "CNY"
        },
        "model_cost_count": 150,
        "judge_cost": {
          "amount": 62.827212,
          "currency": "CNY"
        },
        "judge_cost_count": 149,
        "runtime_seconds_sum": 82425.211991,
        "runtime_count": 150
      }
    },
    {
      "id": "spreadsheetbench-verified",
      "name": "SpreadsheetBench Verified",
      "revision": "1.0:0ad7209b09780e78c6c80f194e49e353191be1cc",
      "expected": 400,
      "judge": {
        "kind": "programmatic",
        "model": null,
        "scorer": "harbor-spreadsheetbench-verified@1.0",
        "official_model": null,
        "prompt_revision": null,
        "parity_note": ""
      },
      "observation_id": "qwenpaw-2.2.2-glm-5.2-spreadsheetbench-verified-20261016",
      "protocol_hash": "60debecdc8e73d8ae1c3917250a0f55301ace3374a670c9584ecd6cd73ba5af4",
      "date": "2026-10-16T19:00:21Z",
      "summary": {
        "score_sum": 343.0,
        "failures": {
          "execution_error": 1
        },
        "model_cost": {
          "amount": 496.743632,
          "currency": "CNY"
        },
        "model_cost_count": 400,
        "judge_cost": {
          "amount": 0.0,
          "currency": "USD"
        },
        "judge_cost_count": 400,
        "runtime_seconds_sum": 151696.524069,
        "runtime_count": 400
      }
    },
    {
      "id": "swebench-verified",
      "name": "SWE-bench Verified",
      "revision": "1.0:86723674f04e4209ac479d0fb75d9d9f44b4377e",
      "expected": 500,
      "judge": {
        "kind": "programmatic",
        "model": null,
        "scorer": "harbor-swebench-verified@1.0",
        "official_model": null,
        "prompt_revision": null,
        "parity_note": ""
      },
      "observation_id": "qwenpaw-2.2.2-glm-5.2-swebench-verified-20261016",
      "protocol_hash": "dbab0ee7047dc1e1e3fdca1f6fbd113221466b21263e942727a9dddb25a7867b",
      "date": "2026-10-17T14:23:34Z",
      "summary": {
        "score_sum": 456.0,
        "failures": {
          "execution_error": 2,
          "artifact_error": 1
        },
        "model_cost": {
          "amount": 2608.612912,
          "currency": "CNY"
        },
        "model_cost_count": 500,
        "judge_cost": {
          "amount": 0.0,
          "currency": "USD"
        },
        "judge_cost_count": 500,
        "runtime_seconds_sum": 360624.879935,
        "runtime_count": 499
      }
    }
  ]
}
